{
  "sls_id": "sls:pair:000001",
  "en": "Synthetic English validator fixture.",
  "so": "synthetic-so-validator-fixture",
  "register": "technical",
  "translation_type": "natural",
  "domain": "machine-learning",
  "metadata": {
    "contributor": "SLS maintainers",
    "source": "Synthetic structural fixture; not language data",
    "date_added": "2026-09-04",
    "review_status": "draft",
    "license": "CC BY 4.0",
    "schema_version": "1.0.0",
    "since_version": "0.3.0"
  }
}
